id,author,content,clean_content,rating,version,date,scraped_at,source
345,Nathaual,I was listening to a short song then a bother short song came on and then an ad I am sick of the ads every single song or two it's another ad and STOP ADDING FRIKING RANDOM SONGS TO MY PLAYLIST,listening short song bother short song came ad sick ads every single song two another ad stop adding friking random songs playlist,2,9.0.40,2025-05-11T11:52:41-07:00,2025-05-15 22:48:04,apple_store
346,yesitis6inches,It is good but I wish that other people could play music in my Fam without stealing my music. I know that you can do that with another account but I don't want to have an extra account,good wish people could play music fam without stealing music know another account want extra account,4,9.0.40,2025-05-11T11:52:12-07:00,2025-05-15 22:48:04,apple_store
347,madwomanforevermore,"every time i choose a song it puts in a different song and i can't ever find the song i want. it is premium to skips songs, shuffle songs, reorder playlists, and simply exist on this app. i hate it",every time choose song puts different song ever find song want premium skips songs shuffle songs reorder playlists simply exist app hate,1,9.0.40,2025-05-11T11:48:46-07:00,2025-05-15 22:48:04,apple_store
348,Tashona1980,I got Spotify to listen to my son music TTM KAM,got spotify listen son music ttm kam,5,9.0.40,2025-05-11T11:46:56-07:00,2025-05-15 22:48:04,apple_store
349,Gottaprob,New update forces spotify every time you close it to open in online mode. Won't stay in offline mode. Extremely annoying please fix.,new update forces spotify every time close open online mode stay offline mode extremely annoying please fix,2,9.0.40,2025-05-11T11:21:28-07:00,2025-05-15 22:48:04,apple_store
350,Mia13852,When I was trying to listen to firework by Katy parry I clicked on the song and it played another song of hers Spotify you need to fix this!,trying listen firework katy parry clicked song played another song spotify need fix,1,9.0.40,2025-05-11T11:21:16-07:00,2025-05-15 22:48:04,apple_store
351,bodybuilderbj,amazing songs and ive had it for years with no problems,amazing songs ive years problems,5,9.0.40,2025-05-11T11:20:47-07:00,2025-05-15 22:48:04,apple_store
352,Dog eater57,I used to listen everyday before I was brutally raped by a dog after saying hi to it. 10/10 I will come back again,used listen everyday brutally raped dog saying hi come back,5,9.0.40,2025-05-11T11:20:09-07:00,2025-05-15 22:48:04,apple_store
353,A2823b,Too many adds inbetween,many adds inbetween,1,9.0.40,2025-05-11T11:13:14-07:00,2025-05-15 22:48:04,apple_store
354,rp-ip,"Why do I have to pay to get off  shuffle
? That's ridiculous",pay get shuffle ridiculous,2,9.0.40,2025-05-11T11:04:10-07:00,2025-05-15 22:48:04,apple_store
355,Learning to cope!,"I'm always working around the house and I'm in and out of the house.   So my hands are filthy or wet, so I can't touch my phone. The music never stops playing music and ask, "" Are you still listening? "" , like the other music provider.   My hands being dirty,  it makes it difficult to answer that annoying question.",always working around house house hands filthy wet touch phone music never stops playing music ask still listening like music provider hands dirty makes difficult answer annoying question,5,9.0.40,2025-05-11T10:52:57-07:00,2025-05-15 22:48:04,apple_store
356,Nobodydhstetwhwhehehd,"Worst app ever, doesn't play what you want and plays random stuff. Not user error literally won't play what I select gives me a few seconds preview but doesn't let me actually play it and doesn't tell you how to play it lol. Probably locked behind a paywall but it never works",worst app ever play want plays random stuff user error literally play select gives seconds preview let actually play tell play lol probably locked behind paywall never works,1,9.0.40,2025-05-11T10:48:40-07:00,2025-05-15 22:48:04,apple_store
357,nermar jr,Do I even have to say anything?,even say anything,5,9.0.40,2025-05-11T10:48:10-07:00,2025-05-15 22:48:04,apple_store
358,Cc/citlaly,I give it 5 starts bc u can play any music u want!,give starts bc u play music u want,5,9.0.40,2025-05-11T10:47:48-07:00,2025-05-15 22:48:04,apple_store
359,Jesus loves all no matter what,"For God so loved the world, that he gave his only begotten Son, that whosoever believeth in him should not perish, but have everlasting life.",god loved world gave begotten son whosoever believeth perish everlasting life,1,9.0.40,2025-05-11T10:43:46-07:00,2025-05-15 22:48:04,apple_store
360,Woodsborne,"I've been a Spotify enjoyer now long enough to have over 8000 songs on my playlist list from many different Genres. There's nothing not to love about Spotify. But of course, I'm just a simple living man. Down to earth, friendly, meek and I love music. 69 years of enjoyment behind me. Spotify makes so easy to enjoy and love the music that dwells in my heart. Thank you Spotify employees for all your hard work with me in mind!",spotify enjoyer long enough songs playlist list many different genres nothing love spotify course simple living man earth friendly meek love music years enjoyment behind spotify makes easy enjoy love music dwells heart thank spotify employees hard work mind,5,9.0.40,2025-05-11T10:37:38-07:00,2025-05-15 22:48:04,apple_store
361,MJM2025,NICK MIX WITH POINT 3FM,nick mix point fm,5,9.0.40,2025-05-11T10:35:26-07:00,2025-05-15 22:48:04,apple_store
362,FbombElExplosivo,The mixes it creates for you are literally what you listen to. Great stuff. 🙌🏽,mixes creates literally listen great stuff,5,9.0.40,2025-05-11T10:31:42-07:00,2025-05-15 22:48:04,apple_store
363,Sharks in your area,I swear every time I listen to one song it gives me a ad right after. Not only that but when I finish listening to two or THREE ads and finally start listening to a song it IMMEDIATELY gives me another ad right after finishing the song.,swear every time listen one song gives ad right finish listening two three ads finally start listening song immediately gives another ad right finishing song,3,9.0.40,2025-05-11T10:31:12-07:00,2025-05-15 22:48:04,apple_store
364,Billl three L,Wow!! I was taken aback after realizing how many people are actually sleeping on this app Spotify is THE APP,wow taken aback realizing many people actually sleeping app spotify app,5,9.0.40,2025-05-11T10:29:39-07:00,2025-05-15 22:48:04,apple_store
365,Emankciner,"This app is nice, though sometimes it does have glitches. I like it a lot.",app nice though sometimes glitches like lot,5,9.0.40,2025-05-11T10:21:05-07:00,2025-05-15 22:48:04,apple_store
366,The best app 10/10 10/10,every 2 freaking songs i have to listen to 3 minutes worth of adds it is actually obnoxious,every freaking songs listen minutes worth adds actually obnoxious,1,9.0.40,2025-05-11T10:10:38-07:00,2025-05-15 22:48:04,apple_store
367,🤑💰💵💸💸,This is the best app because I am able to pick my own songs and my genres,best app able pick songs genres,5,9.0.40,2025-05-11T10:03:50-07:00,2025-05-15 22:48:04,apple_store
368,Gabby Gag,"Eyo Idc about subscriptions, ad after ad you deadass can't play it without subscribing",eyo idc subscriptions ad ad deadass play without subscribing,1,9.0.40,2025-05-11T10:00:09-07:00,2025-05-15 22:48:04,apple_store
369,Nickey Davis,"There is so many ads. Like an overwhelming amount of ads and ""premium only"" features. You cant skip songs or listen to a specific one without paying or having premium. Overall I would say it is not worth downloading if you aren't fine with paying.",many ads like overwhelming amount ads premium features cant skip songs listen specific one without paying premium overall would say worth downloading fine paying,2,9.0.40,2025-05-11T09:52:39-07:00,2025-05-15 22:48:04,apple_store
370,Красная...яблоко,"I'm in the car, have Bluetooth on for maps when music starts up randomly. The app, which isn't even open, is set to ""offline"". Yesterday, in heavy traffic, suddenly music came on. It momentary confused me, I slammed my breaks on to avoid running a red light. Immediately I turned the corner, pulled over and deleted the app. 
     
Now I need to figure out how to cancel my subscription and stop the monthly payment.",car bluetooth maps music starts randomly app even open set offline yesterday heavy traffic suddenly music came momentary confused slammed breaks avoid running red light immediately turned corner pulled deleted app need figure cancel subscription stop monthly payment,2,9.0.40,2025-05-11T09:39:56-07:00,2025-05-15 22:48:04,apple_store
371,TheKingThief111,Kinda just hate that I got to pay to skip songs.,kinda hate got pay skip songs,1,9.0.40,2025-05-11T09:31:07-07:00,2025-05-15 22:48:04,apple_store
372,EIeynaMorse,everything works well 🙂,everything works well,5,9.0.40,2025-05-11T09:29:43-07:00,2025-05-15 22:48:04,apple_store
373,12 y ago,This is da best app cause it Js da best idk y but yea hope y'all agree fine I'll give u one reason I like this app cause when I tried to search something up it's showed what I want to listen. Done okay bye now,da best app cause js da best idk yea hope agree fine give u one reason like app cause tried search something showed want listen done okay bye,5,9.0.40,2025-05-11T09:23:07-07:00,2025-05-15 22:48:04,apple_store
374,Dumplingdwarfie,so great! i love this app. has the best music and easy to read lyrics.,great love app best music easy read lyrics,5,9.0.40,2025-05-11T09:03:00-07:00,2025-05-15 22:48:04,apple_store
375,Upyours1111111,Free  used to be four or five songs then a couple ads. Now two songs four ads.  Lousy.,free used four five songs couple ads two songs four ads lousy,1,9.0.40,2025-05-11T08:57:34-07:00,2025-05-15 22:48:04,apple_store
376,miracle .,"I can't pick the song I want to hear , instead it picks one for me, & I don't like that. Musi is better",pick song want hear instead picks one like musi better,1,9.0.40,2025-05-11T08:48:21-07:00,2025-05-15 22:48:04,apple_store
377,Hunter Nash,I don't why but when I first got the app it played every song perfectly but now when I play a song it is a completely different song I don't know why it does that because not everyone wants to or has money to pay for premium I get that yall can't just remove it but at least play the right song with ads or no ads I don't care,first got app played every song perfectly play song completely different song know everyone wants money pay premium get yall remove least play right song ads ads care,2,9.0.40,2025-05-11T08:19:11-07:00,2025-05-15 22:48:04,apple_store
378,Sigma specialists,Too many ads and I don't want to pay for premium,many ads want pay premium,1,9.0.40,2025-05-11T07:40:43-07:00,2025-05-15 22:48:04,apple_store
379,.Slick.Rick.,"Not subscribed. So when friends share a song and I try to listen, it makes you listen to another ""similar"" song first. The absolute worst music app unless you pay them monthly. Ew.",subscribed friends share song try listen makes listen another similar song first absolute worst music app unless pay monthly ew,1,9.0.40,2025-05-11T07:39:28-07:00,2025-05-15 22:48:04,apple_store
380,sixtoIndacochea,The Best Beatifull,best beatifull,5,9.0.40,2025-05-11T07:32:12-07:00,2025-05-15 22:48:04,apple_store
381,whymylifeisapigsty,i can't play the song i want,play song want,1,9.0.40,2025-05-11T07:08:06-07:00,2025-05-15 22:48:04,apple_store
382,Sandman Max 217,Dear-Spotify I want to mildly clap ur cheeks in Roblox doors or red blue green and yellow planes tower defense fr fr,dear spotify want mildly clap ur cheeks roblox doors red blue green yellow planes tower defense fr fr,5,9.0.40,2025-05-11T06:46:08-07:00,2025-05-15 22:48:04,apple_store
383,Why the heck do we need to do,"I used to love this app. It's still great, but the fact you need pay for premium to go back to a song is wild. Like I understand anything else but that. Allow us to scroll or skip a song of our liking please. It's not that hard",used love app still great fact need pay premium go back song wild like understand anything else allow us scroll skip song liking please hard,1,9.0.40,2025-05-11T06:31:05-07:00,2025-05-15 22:48:04,apple_store
384,olivialynn2000,"i really enjoy the app, but i wish there wasn't a limited amount of skips i think that's really stupid and annoying if your trying to get to a certain song and the adds are really annoying they pop up every 5 songs and i think it's really stupid but other than that the quality of the app and the songs are good i really think you should remove the limited skips please and thank you",really enjoy app wish limited amount skips think really stupid annoying trying get certain song adds really annoying pop every songs think really stupid quality app songs good really think remove limited skips please thank,3,9.0.40,2025-05-11T06:07:28-07:00,2025-05-15 22:48:04,apple_store
385,Cold blooded monsters,It is really easy to find my favorite songs that are normally hard to find on other apps,really easy find favorite songs normally hard find apps,5,9.0.40,2025-05-11T06:03:30-07:00,2025-05-15 22:48:04,apple_store
386,Jlevine018,I love my music and Spotify is my go to app for what I want to hear. It's AI knows what I want to hear. Its catalog is also amazing.,love music spotify go app want hear ai knows want hear catalog also amazing,5,9.0.40,2025-05-11T05:28:00-07:00,2025-05-15 22:48:04,apple_store
387,Skoopstheking,"Been using Spotify for years by now. Great service, and can vouch that Premium is certainly worth it. I found the service just fine without paying the subscription, but the experience is much better without ads, alongside the other premium features. I love the playlists automatically created and tailored to you and have certainly been greeted with much music I love due to features like these. Has its imperfections, but is doubtless my favorite streaming service for music out there.",using spotify years great service vouch premium certainly worth found service fine without paying subscription experience much better without ads alongside premium features love playlists automatically created tailored certainly greeted much music love due features like imperfections doubtless favorite streaming service music,5,9.0.40,2025-05-11T05:25:45-07:00,2025-05-15 22:48:04,apple_store
388,Mololuwae,Spotify amazing 10 out of 10,spotify amazing,5,9.0.40,2025-05-11T05:22:37-07:00,2025-05-15 22:48:04,apple_store
389,Heitri queen of the mysrics,"So a few days ago I wrote a review for Spotify saying that they need to make things free and that it wouldn't play my music. Well I'm doing this again. In my last review I said that I couldn't play songs and how some artist for premium only. Well now that is for all of the artists. The good news is that Spotify isn't my only music app. So I suggest having another music app as a backup. But yeah, Spotify, please make it free.",days ago wrote review spotify saying need make things free play music well last review said play songs artist premium well artists good news spotify music app suggest another music app backup yeah spotify please make free,3,9.0.40,2025-05-11T05:16:50-07:00,2025-05-15 22:48:04,apple_store
390,Kbig daddy,Trash,trash,5,9.0.40,2025-05-11T04:39:33-07:00,2025-05-15 22:48:04,apple_store
391,Evixity8989,It's cool,cool,5,9.0.40,2025-05-11T04:29:43-07:00,2025-05-15 22:48:04,apple_store
392,teyano^^,make your ads diff cuz theyre all the same and its really annoying. the spotify premium ads are all the exact same and atleast make it interesting cuz i hate hearing it,make ads diff cuz theyre really annoying spotify premium ads exact atleast make interesting cuz hate hearing,4,9.0.40,2025-05-11T03:15:05-07:00,2025-05-15 22:48:04,apple_store
393,Red_riding_hood,"If Spotify doesn't bring back the ability/option to add a track to a playlist more than once, I am going to unsubscribe. 
This is especially needed for those of us who use playlists at night for sleep and need a certain track, song, or podcast to repeat more than once in a playlist. 
I am not continuing to pay continually increasing subscription fees every year while no improvements are being made on things users actually want and need from the app.",spotify bring back ability option add track playlist going unsubscribe especially needed us use playlists night sleep need certain track song podcast repeat playlist continuing pay continually increasing subscription fees every year improvements made things users actually want need app,1,9.0.40,2025-05-11T02:55:43-07:00,2025-05-15 22:48:04,apple_store
394,Dola paid,Good application,good application,5,9.0.40,2025-05-11T02:25:39-07:00,2025-05-15 22:48:04,apple_store
395,Hen dung,I mean it's ok. And you know I'm 14 so it's okay for me,mean ok know okay,5,9.0.40,2025-05-11T02:00:46-07:00,2025-05-15 22:48:04,apple_store
396,Meowza2,"the algorithm is messed up, customer service is bots and AI, they do not care about their customers.  terrible experience! i went over to APPLE itunes music and have had way better of an experience.  they provide way better service and is less expensive.  trying to follow other people or even find them or playlists is so difficult.  even if you have premium, making a playlist is difficult, finding specific songs is not easy, even finding your queue is challenging.",algorithm messed customer service bots ai care customers terrible experience went apple itunes music way better experience provide way better service less expensive trying follow people even find playlists difficult even premium making playlist difficult finding specific songs easy even finding queue challenging,1,9.0.40,2025-05-10T23:58:28-07:00,2025-05-15 22:48:04,apple_store
397,No one is home!,Only bad thing are the inescapable ads. I understand why though.,bad thing inescapable ads understand though,5,9.0.40,2025-05-10T23:33:40-07:00,2025-05-15 22:48:04,apple_store
398,powermcu,great quality and great sound but i am getting wayyy to many ads like every 2 songs.,great quality great sound getting wayyy many ads like every songs,3,9.0.40,2025-05-10T22:57:52-07:00,2025-05-15 22:48:04,apple_store
399,Disappointed813,Title says it all; the algorithm for shuffle is atrocious. As a streaming service it's okay.,title says algorithm shuffle atrocious streaming service okay,3,9.0.40,2025-05-10T22:51:28-07:00,2025-05-15 22:48:04,apple_store
400,Seungmin !!,"I love this app with my heart <3, it doesn't act up a lot and its actually good to use , with or without premium. I never have any trouble using the app ! If u read this , I really recommend you to get this app and enjoy it ! Also theres downloads any case your in a area with no service so you don't get interrupted!",love app heart act lot actually good use without premium never trouble using app u read really recommend get app enjoy also theres downloads case area service get interrupted,5,9.0.40,2025-05-10T22:38:13-07:00,2025-05-15 22:48:04,apple_store
401,uziminatii,love this app,love app,5,9.0.40,2025-05-10T22:21:27-07:00,2025-05-15 22:48:04,apple_store
402,iliawx,Spotify is ma second home,spotify second home,5,9.0.40,2025-05-10T21:49:24-07:00,2025-05-15 22:48:04,apple_store
403,Ssssssssssandman,I registered my email a while back. I went in recently and tried to subscribe to a family plan. Not even an option. I absolutely hate the interface cause it provides no options. Never coming back.,registered email back went recently tried subscribe family plan even option absolutely hate interface cause provides options never coming back,1,9.0.40,2025-05-10T21:41:17-07:00,2025-05-15 22:48:04,apple_store
404,papilucifer,"Hello I love this app used it for YEARS with premium since freshman year Im 23 now I like Spotify DJ but I feel like he doesn't give new music all that often I would like to suggest that you add in like a ""discover DJ"" that would be all new songs or songs in categories I listen to but have not heard. Anyways thats my feedback thank you.",hello love app used years premium since freshman year im like spotify dj feel like give new music often would like suggest add like discover dj would new songs songs categories listen heard anyways thats feedback thank,4,9.0.40,2025-05-10T21:39:05-07:00,2025-05-15 22:48:04,apple_store
405,th1susername1salreadytaken,Tristan.tbh is the only reason I have Spotify so go follow him and stay tuned because this small artist is gonna become famous soon so be a og or you hate Spotify,tristan tbh reason spotify go follow stay tuned small artist gon na become famous soon og hate spotify,5,9.0.40,2025-05-10T21:32:06-07:00,2025-05-15 22:48:04,apple_store
406,Don't understand the hype,for Spotify it started off fine but you do have to pay for no ads and you don't even get to skip songs you want and also press play on a song and it doesn't even play the right songs. You don't even get to play the song you want without being shuffled within other songs you didn't even want and have to have premium for everything and ads after every song being played,spotify started fine pay ads even get skip songs want also press play song even play right songs even get play song want without shuffled within songs even want premium everything ads every song played,2,9.0.40,2025-05-10T21:16:22-07:00,2025-05-15 22:48:04,apple_store
407,My boy Jaceee,It Spotify what do you expect it has music chill music Mexican music and way more Togo so download the app today and get to listening,spotify expect music chill music mexican music way togo download app today get listening,5,9.0.40,2025-05-10T20:54:36-07:00,2025-05-15 22:48:04,apple_store
408,djiwnsbsbTITS,"sometimes i wanna blow my shi smoove off, sometimes my third leg rises",sometimes wan na blow shi smoove sometimes third leg rises,5,9.0.40,2025-05-10T20:51:00-07:00,2025-05-15 22:48:04,apple_store
409,Justic League,Love Spotify !  Amazing,love spotify amazing,5,9.0.40,2025-05-10T20:46:19-07:00,2025-05-15 22:48:04,apple_store
410,Big Calichris,"Great app variety of artist and cuts run deep Other appsAre lacking thank you Spotify keep on rocking in the free World
Amazing app life is not the same without Spotify",great app variety artist cuts run deep appsare lacking thank spotify keep rocking free world amazing app life without spotify,5,9.0.40,2025-05-10T20:38:32-07:00,2025-05-15 22:48:04,apple_store
411,Hatsune_Miku_01,"There is a bug/glitch with some songs, when I search and put a specific song, 9 times out of 10 it sends me to another song and I have to manually look for which song is the right one.",bug glitch songs search put specific song times sends another song manually look song right one,2,9.0.40,2025-05-10T20:29:43-07:00,2025-05-15 22:48:04,apple_store
412,LovePinkMaddi,they're robbing us if u don't have premium tho kinda unfair but i get it,robbing us u premium tho kinda unfair get,4,9.0.40,2025-05-10T20:22:09-07:00,2025-05-15 22:48:04,apple_store
413,QWEEN923,Spotify changed me I used to be uncultured and boring now I thrive with my music and when I had depression Billie elish Saved me,spotify changed used uncultured boring thrive music depression billie elish saved,5,9.0.40,2025-05-10T20:19:08-07:00,2025-05-15 22:48:04,apple_store
414,Little Haley,"Sometimes when I play a song, it plays a whole different song, but everything else is fine…",sometimes play song plays whole different song everything else fine,3,9.0.40,2025-05-10T20:16:40-07:00,2025-05-15 22:48:04,apple_store
415,Titaniumboiiiii,After every song i play there as a add,every song play add,1,9.0.40,2025-05-10T20:13:36-07:00,2025-05-15 22:48:04,apple_store
416,green Greer,I love Spotify so much! It is my favorite! I love to listen to all my favorite songs on Spotify!❤️❤️❤️❤️❤️❤️❤️❤️❤️❤️❤️❤️❤️I absolutely love Spotify cause I can listen to movie sound tracks or YouTube songs from dances,love spotify much favorite love listen favorite songs spotify absolutely love spotify cause listen movie sound tracks youtube songs dances,5,9.0.40,2025-05-10T20:08:47-07:00,2025-05-15 22:48:04,apple_store
417,chaelims,How is it that SOME people have the snake game with their Spotify but other premium users don't make it make sense,people snake game spotify premium users make make sense,1,9.0.40,2025-05-10T20:07:16-07:00,2025-05-15 22:48:04,apple_store
418,be11a.1065,Good app but I seriously get tired of hear an add every 2 songs when it tells me 30 minutes of no adds. False information it gives me 30 minutes of adds more than music. This is a music app not a promo app I shouldn't have to pay money to listen to music on a music app. It also doesn't play songs i look for it plays songs other than what I am searching for,good app seriously get tired hear add every songs tells minutes adds false information gives minutes adds music music app promo app pay money listen music music app also play songs look plays songs searching,3,9.0.40,2025-05-10T19:55:45-07:00,2025-05-15 22:48:04,apple_store
419,truly des,Way better than Apple Music and it's free,way better apple music free,5,9.0.40,2025-05-10T19:49:37-07:00,2025-05-15 22:48:04,apple_store
420,spencer thorn,Has way too many ads and the ads are way too long,way many ads ads way long,1,9.0.40,2025-05-10T19:20:27-07:00,2025-05-15 22:48:04,apple_store
421,HenPup32,"Without Spotify premium, it plays an ad after every stinkin song. It's boutta have me crashing out. Spotify better stinkin lock in before I lose it!! Nah nah nah!",without spotify premium plays ad every stinkin song boutta crashing spotify better stinkin lock lose nah nah nah,3,9.0.40,2025-05-10T19:19:52-07:00,2025-05-15 22:48:04,apple_store
422,domalsbsusn,Best music app oat,best music app oat,5,9.0.40,2025-05-10T19:07:03-07:00,2025-05-15 22:48:04,apple_store
423,alexm287,"This might be the most annoying thing ever, and earns you an instant 1 star from me",might annoying thing ever earns instant star,1,9.0.40,2025-05-10T19:04:04-07:00,2025-05-15 22:48:04,apple_store
