id,author,content,clean_content,rating,version,date,scraped_at,source
603,Ron Middleton,"I love Spotify and have for years, use it almost every single day. So when they added the option to listen to audio books with the premium subscription I was very excited, however, who ever decided to put a limit on how many chapters you can listen to and then decided you can buy more chapters for the same price as I pay for my premium subscription deserves to get fired. That is the stupidest thing I've ever seen. Do better Spotify.",love spotify years use almost every single day added option listen audio books premium subscription excited however ever decided put limit many chapters listen decided buy chapters price pay premium subscription deserves get fired stupidest thing ever seen better spotify,3,8.9.94.470,2024-11-28 00:21:24,2025-05-15 22:47:25,google_play
604,Catherine W.,"Spotify has a host of issues and bizarre decisions masquerading as features. Smart shuffle is horrendous, and there is still no way to disable it. There's an influx of ""Ai features"" being added that no one wants as well as spotify offical playlists filled with Ai generated music. It's disappointing and makes the app less intuitive. If this continues, I'm absolutely ditching spotify for an MP3 player.",spotify host issues bizarre decisions masquerading features smart shuffle horrendous still way disable influx ai features added one wants well spotify offical playlists filled ai generated music disappointing makes app less intuitive continues absolutely ditching spotify mp player,1,9.0.0.487,2024-12-17 15:02:18,2025-05-15 22:47:25,google_play
605,A Google user,"I've been loyal to Spotify for over a decade. But it is not the same platform it used to be. It is impossible to discover small artists. My recommendations are clogged with popular sponsored artists, even ones I've BLOCKED. All the cool features and staff curated playlists are soulless AI garbage now that Spotify has laid off hundreds of employees. Adding songs to a playlist (my favorite feature) frequently crashes my phone. Premium rates rise. If I find a good alternative, I will switch.",loyal spotify decade platform used impossible discover small artists recommendations clogged popular sponsored artists even ones blocked cool features staff curated playlists soulless ai garbage spotify laid hundreds employees adding songs playlist favorite feature frequently crashes phone premium rates rise find good alternative switch,2,9.0.10.415,2025-01-22 21:43:52,2025-05-15 22:47:25,google_play
606,Dylan Bulfin,"The app will regularly try to fetch data about my downloaded albums from the internet even when I'm completely disconnected or have an inconsistent connection. The only way around this is to turn on airplane mode or put Spotify on offline mode, neither of which is something I'm willing to do every time want to listen to music on the subway. Apple Music is worse in every single other way but I will have to go back because working downloads are absolutely essential in a paid service like this",app regularly try fetch data downloaded albums internet even completely disconnected inconsistent connection way around turn airplane mode put spotify offline mode neither something willing every time want listen music subway apple music worse every single way go back working downloads absolutely essential paid service like,1,8.9.98.488,2024-12-12 21:37:42,2025-05-15 22:47:25,google_play
607,Effie,"I've been using Spotify for almost 10 years. I've noticed that the app no longer shuffles my playlits, so the same songs keep playing over and over again. I'm on the premium plan, yet I'm still getting ads on podcasts and I don't have access to audio books. There are some podcasts that I used to listen to almost daily that have now become locked. What's the point of paying for a premium subscription if I don't gain access to everything the app offers?",using spotify almost years noticed app longer shuffles playlits songs keep playing premium plan yet still getting ads podcasts access audio books podcasts used listen almost daily become locked point paying premium subscription gain access everything app offers,2,9.0.2.459,2025-01-10 08:44:29,2025-05-15 22:47:25,google_play
608,Vin K,"Update: Nothing has changed from my previous review. Additionally they have updated the queue function and it's terribly ugly and less useful than it used to be with the addition of 3 useless buttons at the bottom that hog up the screen. The buttons are offered literally on the normal playback screen but they have bloated them into the queue UI. Price has increased year over year, The audiobook section is pricegated even for subscription holders, and they pay the artists pennies on the dollar.",update nothing changed previous review additionally updated queue function terribly ugly less useful used addition useless buttons bottom hog screen buttons offered literally normal playback screen bloated queue ui price increased year year audiobook section pricegated even subscription holders pay artists pennies dollar,1,9.0.18.604,2025-02-16 04:53:42,2025-05-15 22:47:25,google_play
609,Jimmy Melendez (bigjim76),"It was all good until you changed the layout on the playlists. I thought the app was acting screwy. I kept closing the app. Somehow, I kept noticing the two words and more on my playlist, and it goes to the songs. What in the blazes did you do to this app? I haven't had this app for a long time, and you're right away charging the app. It was fine the way it is. Please change it back. It was much easier before this hooey of a layout.",good changed layout playlists thought app acting screwy kept closing app somehow kept noticing two words playlist goes songs blazes app app long time right away charging app fine way please change back much easier hooey layout,3,8.9.98.488,2024-12-11 10:53:07,2025-05-15 22:47:25,google_play
610,C Boots,"Man, I've used Spotify for close to 10 years but it's become such garbage. I have premium and still get ads. While listening to podcasts after a mid-epusode ad break it will sometimes skip to the next episode or many episodes prior. If I get a notification, it will sometimes rewind 5+ minutes. To top it all off shuffling a playlist yesterday played the same song over 5 times withing 30 minutes. Absolutely ridiculous and barely even a functioning app anymore.",man used spotify close years become garbage premium still get ads listening podcasts mid epusode ad break sometimes skip next episode many episodes prior get notification sometimes rewind minutes top shuffling playlist yesterday played song times withing minutes absolutely ridiculous barely even functioning app anymore,1,8.9.98.488,2024-12-13 04:15:19,2025-05-15 22:47:25,google_play
611,Danny Martinez,"App is good but glitchy. It randomly freezes my music and I usually have to unpause it a few times to get it playing again. Really annoying so I thought my Internet was the problem so I got the individual premium plan to listen ad free and offline, so I downloaded a few playlists turn Spotify to offline and to get no interruptions I turn on airplane mode. It still randomly freezes my songs, I don't understand why no Internet to interfere, good storage, new phone, app updated. I'm not sure why.",app good glitchy randomly freezes music usually unpause times get playing really annoying thought internet problem got individual premium plan listen ad free offline downloaded playlists turn spotify offline get interruptions turn airplane mode still randomly freezes songs understand internet interfere good storage new phone app updated sure,3,9.0.0.487,2024-12-18 07:18:22,2025-05-15 22:47:25,google_play
612,Kae Em,"Easy access to alot of music but still some issues. Songs disappear from my liked list and I have to add them back. Also usually end of year wrapped is alot of fun but this year it sucked. Didnt give me nearly as much info as last year. And this year's ""genres"" were just strings of random words. It was really disappointing compared to past years.",easy access alot music still issues songs disappear liked list add back also usually end year wrapped alot fun year sucked didnt give nearly much info last year year genres strings random words really disappointing compared past years,3,8.9.98.488,2024-12-09 07:35:25,2025-05-15 22:47:25,google_play
613,Katelyn Luna,"Will randomly replace songs with different versions/ different audios. It'll be the same listing, it's in my playlist, but one day the audio is randomly a ukulele acoustic cover. Very frustrating and only happens to smaller/indie songs and mostly electronic ones (like masquerade by sixouiee sixta) Edit: now 2 stars. No, this is not just on my app. It's on browser two. Terrible response. Tkaing away a star.",randomly replace songs different versions different audios listing playlist one day audio randomly ukulele acoustic cover frustrating happens smaller indie songs mostly electronic ones like masquerade sixouiee sixta edit stars app browser two terrible response tkaing away star,2,9.0.14.561,2025-02-05 06:48:25,2025-05-15 22:47:25,google_play
614,Desi March,Music history? Before I could see every song I listened to. Now it's categorized and showing me playlists I've played and new songs that I've liked. I just want to be able to view what I listened to for the last 4 songs. ????! I've been playing for Spotify for 6 years now. 20 dollars is allot for all the issues it has and random times it will just stop playing . I'm the only person in my acc. There are glitches with shared jams etc. It's inexcusable for 20$ per month. Come on Spotify,music history could see every song listened categorized showing playlists played new songs liked want able view listened last songs playing spotify years dollars allot issues random times stop playing person acc glitches shared jams etc inexcusable per month come spotify,2,9.0.12.567,2025-01-27 05:18:13,2025-05-15 22:47:25,google_play
615,Ken,"I enjoy using spotify and have been using it for quite a while. It's definitely been going down in quality - more AI usage that's not very accurate, more bugs and crashes, the same songs playing in order over and over again. Would give more stars if the artists were paid more equitably compared to the owners of spotify...",enjoy using spotify using quite definitely going quality ai usage accurate bugs crashes songs playing order would give stars artists paid equitably compared owners spotify,1,8.9.98.488,2024-12-11 22:10:34,2025-05-15 22:47:25,google_play
616,Zoey Bryant,"Premium user here, love it but there are a few flaws. 1, I have multiple playlists downloaded but I typically get stuck on a loading screen which makes it super hard to listen on the go. 2, I have max or almost max Playlists and instead of going through every song on shuffle, it only plays the same 12 or so songs in the same order. 3, for wrapped, i think It might benefit if we start counting music past october. I have a shifting music taste so I'd love to see some new artists i like on there.",premium user love flaws multiple playlists downloaded typically get stuck loading screen makes super hard listen go max almost max playlists instead going every song shuffle plays songs order wrapped think might benefit start counting music past october shifting music taste love see new artists like,4,8.9.96.476,2024-12-03 20:02:22,2025-05-15 22:47:25,google_play
617,Noah,"It was great, until the latest update, where whenever I looked up an artist in my liked songs I couldn't listen to just that artist on loop, it started playing whatever was supposed to play next in my liked songs playlist, which is horrible because now I have to make seperate albums just to listen to specific artists. I, personally, am not a fan in the slightest.",great latest update whenever looked artist liked songs listen artist loop started playing whatever supposed play next liked songs playlist horrible make seperate albums listen specific artists personally fan slightest,1,9.0.8.127,2025-01-12 18:29:09,2025-05-15 22:47:25,google_play
618,Mara* Ponce,"1. I want to listen to playlist folders on shuffle in the mobile app. It's dumb that we can do it on the desktop app but not mobile. 2. I want a bigger space to manage my playlists. I hate the tiny sidebar! I want to toggle between thumbnails and list-view in the primary windrow. 3. I want to be able to click on a track and see what playlists I have added it to, without first trying to add it to get the ""already on this playlist, add again?"" notice. Thank you",want listen playlist folders shuffle mobile app dumb desktop app mobile want bigger space manage playlists hate tiny sidebar want toggle thumbnails list view primary windrow want able click track see playlists added without first trying add get already playlist add notice thank,4,9.0.2.459,2025-01-09 02:27:04,2025-05-15 22:47:25,google_play
619,pokemon is cool,"I still really like the idea of Spotify and how everything works but the fact I have to pay to skip songs after 6 tries and then can't for an entire hour is ridiculous, also not being able to show lyrics is crazy. The Spotify wrapped this year was also weird and ai generated. Can you just show an ad and get 6 more skips??? If you made it where you could watch an ad for like 6 more skips it would be greatly appreciated and you won't lose money.",still really like idea spotify everything works fact pay skip songs tries entire hour ridiculous also able show lyrics crazy spotify wrapped year also weird ai generated show ad get skips made could watch ad like skips would greatly appreciated lose money,2,9.0.2.459,2024-12-29 12:23:02,2025-05-15 22:47:25,google_play
620,Alexis Huffman,"I remember when Spotify was first coming around and getting popular. Over the MANY years I've used Spotify it's just become a money grab to listen to music. I've watched the prices for the subscriptions keep going UP, SO many ads, & it's just gotten so bad over the MANY years I've used it. It's sad cause if there was some other app I would have left Spotify a long time ago, but until that happens I'm stuck with using it until that time comes. U can't even listen to one song without getting a ad",remember spotify first coming around getting popular many years used spotify become money grab listen music watched prices subscriptions keep going many ads gotten bad many years used sad cause app would left spotify long time ago happens stuck using time comes u even listen one song without getting ad,1,9.0.0.487,2024-12-28 07:45:04,2025-05-15 22:47:25,google_play
621,Joshua Anderson,"As a podcast player, this app is a bit annoying when trying to listen to a queue of episodes. For such a popular player, I can't believe that they have no way to sort them by oldest to newest on Android, only newest to oldest. Update: for some reason the app is shuffling my ""my episodes"" list even though it isn't an option a user can turn on and off. Dec 2024 update: they've resolved the queue issue and the podcast listening experience is much improved. Now 5 stars.",podcast player app bit annoying trying listen queue episodes popular player believe way sort oldest newest android newest oldest update reason app shuffling episodes list even though option user turn dec update resolved queue issue podcast listening experience much improved stars,5,9.0.0.487,2024-12-17 03:08:33,2025-05-15 22:47:25,google_play
622,jm,"sucks if you arent on premium. youre forced to listen to ads more than music, cant even look at the lyrics anymore without it having a 1 hour cooldown, cant loop songs, cant replay a song, 6 skips an hour, cant listen to a song by search, cant even see songs in a playlist/album that wasnt made by you, the list goes on. the only things you can do for free is make a playlist and press play.",sucks arent premium youre forced listen ads music cant even look lyrics anymore without hour cooldown cant loop songs cant replay song skips hour cant listen song search cant even see songs playlist album wasnt made list goes things free make playlist press play,3,8.9.98.488,2025-01-02 03:18:03,2025-05-15 22:47:25,google_play
623,Aiden “River Carver” Smith,"I used to use spotify alot and I thought it was the best music app, but that was only because I was paying for premium, without premium you can't even skip or pick any of the music, you can only use shuffle or play it the playlist regularly but with my playlist I have a bunch of the same people over and over and that gets annoying, plus the app usually closes when I try to use it in the background then it gives me three 30 second ads after it just told me I get 30 minutes of uninterrupted music.",used use spotify alot thought best music app paying premium without premium even skip pick music use shuffle play playlist regularly playlist bunch people gets annoying plus app usually closes try use background gives three second ads told get minutes uninterrupted music,1,8.9.96.476,2024-11-30 09:14:39,2025-05-15 22:47:25,google_play
624,Courtney Clendenning,"I enjoy the variety of music provided, but I wish DJ would actually allow me to explore new genres and artists rather than just play my liked list. Sometimes I just want something new to vibe to! Honestly, what's the point of DJ when 95% of the time it's my liked playlist, with occasional ""top songs of 202_"" that is nowhere in the realm of my music preference.",enjoy variety music provided wish dj would actually allow explore new genres artists rather play liked list sometimes want something new vibe honestly point dj time liked playlist occasional top songs nowhere realm music preference,2,9.0.2.459,2024-12-28 04:52:30,2025-05-15 22:47:25,google_play
625,Cory roberts,"Ads are getting outta control,I remember when it used to say enjoy 30 minutes of uninterrupted music and you got 30 minutes. But now every single time it says that I get an add break of 3 or 4 ads after ever song. It's ridiculous and it's also false advertising if I'm not mistake. Also idm when it happened but why is it locked behind a pay wall to not have to shuffle the Playlist. Spotify used to be absolutely the best music app and now I find myself tiring of more ads than music.",ads getting outta control remember used say enjoy minutes uninterrupted music got minutes every single time says get add break ads ever song ridiculous also false advertising mistake also idm happened locked behind pay wall shuffle playlist spotify used absolutely best music app find tiring ads music,3,9.0.10.415,2025-01-19 19:53:05,2025-05-15 22:47:25,google_play
626,An Ma,"I just wanted 2 leave feedback but couldn't from the app because of ""typeform"". Anyways I'm still pretty new 2 the jam feature, but I've quickly noticed, at least when im on a jam started by not me, I cant go and find those songs in my recents list afterwards, which is a total bummer. I can see some songs, but only ones I've already liked, which kinda defeats the purpose IMO, since usually I'm there trying 2 find songs I wanted 2 save but couldnt. Just an idea 2 add 2 user experience! Thanks!",wanted leave feedback app typeform anyways still pretty new jam feature quickly noticed least im jam started cant go find songs recents list afterwards total bummer see songs ones already liked kinda defeats purpose imo since usually trying find songs wanted save couldnt idea add user experience thanks,4,9.0.2.459,2024-12-29 10:57:26,2025-05-15 22:47:25,google_play
627,avenley friday,"i love spotify, definitely my favorite music service and one of my favorite apps in general but THE ADS. i dont understand why there are so many ads in such a long line, and theyre played more than songs are. i can tell you, ive listened to my favorite song (formidable by twenty one pilots) probably 90 times (since i started tracking the music). and ive listened to to lowes advert over 105 times😭 can we please cut down on th ads just a bit???",love spotify definitely favorite music service one favorite apps general ads dont understand many ads long line theyre played songs tell ive listened favorite song formidable twenty one pilots probably times since started tracking music ive listened lowes advert times please cut th ads bit,4,9.0.10.415,2025-01-24 09:12:55,2025-05-15 22:47:25,google_play
628,Corey,"A great mobile app for song discovery and keeping track of your favorite songs. Subscription is a good price, especially if you plan on sharing it with family/friends. Download favorite songs to keep them for offline playing. Collaborative playlists are nice, and playlists are easy to make and keep track of. Great selection of music, old and new, and podcasts. I use this daily for commuting, or to play in the background of other things I have going on.",great mobile app song discovery keeping track favorite songs subscription good price especially plan sharing family friends download favorite songs keep offline playing collaborative playlists nice playlists easy make keep track great selection music old new podcasts use daily commuting play background things going,5,9.0.2.459,2024-12-23 10:16:24,2025-05-15 22:47:25,google_play
629,Cam Deguffroy,"Spotify is the most amazing app that I have ever downloaded, it has like every single song that exists, and offers most songs in different languages (if u don't speak English). The only thing that I would like them 2 improve is the lyrics and time sinking them. They r most likely 2 fix it if you report it, and when u do it takes like 1-2 weeks to be fixed. But this app does not only have music it has podcasts, a DJ that makes playlist for you, episodes of craters strate from YouTube and more",spotify amazing app ever downloaded like every single song exists offers songs different languages u speak english thing would like improve lyrics time sinking r likely fix report u takes like weeks fixed app music podcasts dj makes playlist episodes craters strate youtube,5,9.0.10.415,2025-02-08 09:46:16,2025-05-15 22:47:25,google_play
630,Axmlx,"It's definitely one of the best music apps out there the paid version is perfect (obviously) but the free version is just awful. You can't listen to certain songs for whatever reason, and ads go off in literally less than 30 minutes plus having to listen to not one, not two, but about 3-5 ads. And I feel like you should be able to rewind a song paid or not it just feels a little unfair to me.",definitely one best music apps paid version perfect obviously free version awful listen certain songs whatever reason ads go literally less minutes plus listen one two ads feel like able rewind song paid feels little unfair,4,9.0.0.487,2024-12-23 10:27:02,2025-05-15 22:47:25,google_play
631,Adam Goodwin,"I flippin' love Wrapped! I look forward to it at the end of every year. Wrapped is the summary playlist that is ""You,"" the listener and I love it. Also, thanks for expanding more into video podcasts and including audio books. I look forward to the day when Spotify beats youtube. Keep up the great work! One gripe: stop the location tracking with the duo plan. As long as you get paid, you shouldn't care how users share the app. Be grateful that users want to pay you to share this app with others.",flippin love wrapped look forward end every year wrapped summary playlist listener love also thanks expanding video podcasts including audio books look forward day spotify beats youtube keep great work one gripe stop location tracking duo plan long get paid care users share app grateful users want pay share app others,4,8.9.98.488,2024-12-07 09:46:19,2025-05-15 22:47:25,google_play
632,Serenity,"This app was great for like the first 3 months ish but after that I started to get a lot of ads then when I went to go listen to one of my playlists it would play random songs. Then when I would search a song up say ""Dance the Night"" I would click the song then it would start playing a bunch of random songs and would never play the song I wanted.",app great like first months ish started get lot ads went go listen one playlists would play random songs would search song say dance night would click song would start playing bunch random songs would never play song wanted,3,8.9.98.488,2024-12-07 22:10:34,2025-05-15 22:47:25,google_play
633,Francisco,"Best song streaming app in my opinion. I like the way it's all layed out. You can pretty much find any song there. Only downside this app has is that if you are using the free version you are limited to 6 skips per hour you can't choose the shuffle style, and the most annoying is the Ads. I payed for the premium version which is much better.",best song streaming app opinion like way layed pretty much find song downside app using free version limited skips per hour choose shuffle style annoying ads payed premium version much better,5,9.0.2.459,2025-01-06 08:21:26,2025-05-15 22:47:25,google_play
634,Garrett Organek,"Consistently my queue is wiped and the song I was playing disappears, almost like the app shuts down while it's still open. Some days the app doesn't work at all and needs to be deleted and redownload. Either it works okay or doesn't work at all. This has been an issue for well over a year with no resolve.",consistently queue wiped song playing disappears almost like app shuts still open days app work needs deleted redownload either works okay work issue well year resolve,2,8.9.98.488,2024-12-11 21:40:54,2025-05-15 22:47:25,google_play
